Franchise Group,Name,Title
National Fitness Partners,"Stephen Kindler, Jr.","Stephen Kindler, Jr., has dedicated the past 15+ years to the fitness industry, beginning his work inside health clubs as a young boy at his family-owned West Shore Health Club in Camp Hill, Pa."
Grand Fitness Partners,Oops! This page cannot be found.,Leadership
United Fitness Partners,United FP Rings in the New Year with Big Leadership Changes,Executive
United Fitness Partners,Leave a comment Cancel reply,Executive
United Fitness Partners,Members Only,Executive
